{
  "version": "v0",
  "packet_id": "pre_boundary_collapse_governance_evidence_packet_v0",
  "packet_model": "deterministic_representative_reviewer_packet",
  "purpose": "Summarize the governance trace, evidence refs, safeguards, and representative intervention categories for reviewer inspection.",
  "generated_from": {
    "scenario_id": "pre_boundary_collapse",
    "source_payload": "governance_layer_snapshot"
  },
  "decision_context_summary": {
    "bind_outcome": "FORMALLY_VALID_STRUCTURALLY_COLLAPSED",
    "participation_signal": "decision_shaping",
    "preservation_state": "collapsed",
    "intervention_viability": "lost",
    "decision_space_state": "structurally_narrowed_before_bind",
    "summary": "The bind outcome remains formally valid while governance evidence indicates decision-space narrowing and intervention viability loss occurred upstream."
  },
  "packet_sections": [
    {
      "id": "trajectory_summary",
      "source_layer": "trajectory_shaping_lineage_v0",
      "title": "Trajectory shaping summary",
      "key_points": [
        "Decision-space transformation occurred before bind.",
        "Preservation degradation and intervention viability loss are visible in the trajectory.",
        "Formal bind admissibility is evaluated after structural narrowing."
      ],
      "evidence_refs": [
        "governance_layer_snapshot.trajectory_shaping_lineage",
        "governance_layer_snapshot.phase_snapshots",
        "governance_layer_snapshot.bind_outcome"
      ]
    },
    {
      "id": "dynamic_degradation_summary",
      "source_layer": "dynamic_conditions_validation_v0",
      "title": "Dynamic degradation summary",
      "key_points": [
        "Reinforcement, exposure asymmetry, time pressure, and adaptive behavior interact before bind.",
        "The intervention window compresses before bind.",
        "The decision is evaluated over a dynamically narrowed space."
      ],
      "evidence_refs": [
        "governance_layer_snapshot.trajectory_shaping_lineage.dynamic_conditions_validation_case"
      ]
    },
    {
      "id": "irreversibility_summary",
      "source_layer": "irreversibility_horizon_v0",
      "title": "Irreversibility horizon summary",
      "key_points": [
        "The first structural degradation signal is marked.",
        "The last meaningful intervention phase is marked.",
        "Bind occurs after the representative horizon."
      ],
      "evidence_refs": [
        "governance_layer_snapshot.trajectory_shaping_lineage.dynamic_conditions_validation_case.irreversibility_horizon"
      ]
    },
    {
      "id": "recognition_gap_summary",
      "source_layer": "actor_recognition_gap_v0",
      "title": "Actor recognition gap summary",
      "key_points": [
        "Structural degradation may become visible before actors fully recognize intervention capacity loss.",
        "The recognition gap is represented without inferring actor psychology.",
        "Bind occurs after the recognition gap."
      ],
      "evidence_refs": [
        "governance_layer_snapshot.trajectory_shaping_lineage.dynamic_conditions_validation_case.irreversibility_horizon.actor_recognition_gap"
      ]
    },
    {
      "id": "governance_attack_surface_summary",
      "source_layer": "governance_attack_surface_registry_v0",
      "title": "Governance attack surface summary",
      "key_points": [
        "The governance process itself can become an attack surface.",
        "Representative failure classes include self-authorization, evidence-chain manipulation, spoofed approval, policy drift, escalation suppression, replay tampering, and recognition-gap masking.",
        "The registry does not claim complete security or certification."
      ],
      "evidence_refs": [
        "governance_layer_snapshot.governance_attack_surface_registry"
      ]
    },
    {
      "id": "safeguard_coverage_summary",
      "source_layer": "governance_safeguard_coverage_matrix_v0",
      "title": "Safeguard coverage summary",
      "key_points": [
        "Each representative failure class is mapped to a primary safeguard.",
        "Each row includes evidence requirements for visibility.",
        "Coverage remains representative visibility only."
      ],
      "evidence_refs": [
        "governance_layer_snapshot.governance_attack_surface_registry.safeguard_coverage_matrix"
      ]
    },
    {
      "id": "intervention_actionability_summary",
      "source_layer": "intervention_actionability_map_v0",
      "title": "Intervention actionability summary",
      "key_points": [
        "Visible governance markers are mapped to representative intervention categories.",
        "The map provides guidance without automatic enforcement.",
        "Evidence preservation remains explicit."
      ],
      "evidence_refs": [
        "governance_layer_snapshot.intervention_actionability_map"
      ]
    }
  ],
  "reviewer_questions": [
    "What was the bind outcome?",
    "What decision-space narrowing occurred before bind?",
    "When did intervention viability begin degrading?",
    "Where was the last meaningful intervention point?",
    "Did actor recognition lag behind structural degradation?",
    "Which governance attack surfaces were relevant?",
    "Which safeguards made those surfaces visible?",
    "Which intervention categories were representative?",
    "What does this packet not claim?"
  ],
  "preserved_evidence_refs": [
    "governance_layer_snapshot.trajectory_shaping_lineage",
    "governance_layer_snapshot.trajectory_shaping_lineage.dynamic_conditions_validation_case",
    "governance_layer_snapshot.trajectory_shaping_lineage.dynamic_conditions_validation_case.irreversibility_horizon",
    "governance_layer_snapshot.trajectory_shaping_lineage.dynamic_conditions_validation_case.irreversibility_horizon.actor_recognition_gap",
    "governance_layer_snapshot.governance_attack_surface_registry",
    "governance_layer_snapshot.governance_attack_surface_registry.safeguard_coverage_matrix",
    "governance_layer_snapshot.intervention_actionability_map"
  ],
  "limitations": [
    "not_certification",
    "not_production_security_guarantee",
    "not_automatic_enforcement",
    "not_automatic_attack_detection",
    "not_scoring_model",
    "not_legal_conclusion",
    "representative_demo_packet_only"
  ],
  "summary": {
    "concise": "Governance Evidence Packet v0 gives reviewers a compact, deterministic summary of the governance trace, evidence refs, safeguards, and representative intervention categories.",
    "operator": "The system should show what evidence a reviewer should inspect without claiming certification, automatic enforcement, or production security."
  }
}
